{
  "$schema": "http://json-schema.org/draft-07/schema#",
  "title": "TH-04 Capability Audit Universe",
  "type": "object",
  "additionalProperties": false,
  "required": ["schema_version", "plan_id", "mission_id", "repository_revision", "generated_at", "source_inputs", "evidence_refs", "limitations", "result", "artifact_type", "discovery_scope_ref", "candidates", "unresolved_candidates"],
  "properties": {
    "schema_version": {"const": "1.0.0"},
    "plan_id": {"const": "PLAN_004"},
    "mission_id": {"const": "TH-04"},
    "repository_revision": {"type": "string", "minLength": 1},
    "generated_at": {"type": "string", "format": "date-time"},
    "source_inputs": {"type": "array", "minItems": 1, "items": {"$ref": "#/$defs/source_input"}},
    "evidence_refs": {"type": "array", "items": {"type": "string", "minLength": 1}},
    "limitations": {"type": "array", "items": {"type": "string", "minLength": 1}},
    "result": {"enum": ["PASS", "COMPLETED_WITH_FINDINGS", "LIMITATION"]},
    "artifact_type": {"const": "CAPABILITY_AUDIT_UNIVERSE"},
    "discovery_scope_ref": {"const": "TH04_capability_discovery_scope.json"},
    "candidates": {"type": "array", "items": {"$ref": "#/$defs/candidate"}},
    "unresolved_candidates": {"type": "array", "items": {"type": "string", "minLength": 1}}
  },
  "$defs": {
    "source_input": {
      "type": "object",
      "additionalProperties": false,
      "required": ["path", "sha256"],
      "properties": {
        "path": {"type": "string", "minLength": 1},
        "sha256": {"type": ["string", "null"], "pattern": "^[a-f0-9]{64}$"}
      }
    },
    "candidate": {
      "type": "object",
      "additionalProperties": false,
      "required": ["candidate_id", "canonical_identity", "aliases", "source_type", "source_refs", "current_registry_presence", "object_class", "disposition", "registry_state", "classification_reason", "owner_observation", "maturity_observed", "observed_refs", "resolved_artifacts", "inconsistencies", "evidence_refs"],
      "properties": {
        "candidate_id": {"type": "string", "minLength": 1},
        "canonical_identity": {"type": "string", "minLength": 1},
        "aliases": {"type": "array", "minItems": 1, "items": {"type": "string", "minLength": 1}},
        "source_type": {"type": "string", "minLength": 1},
        "source_refs": {"type": "array", "minItems": 1, "items": {"type": "string", "minLength": 1}},
        "current_registry_presence": {"type": "boolean"},
        "object_class": {"enum": ["EXECUTABLE_CAPABILITY", "NON_EXECUTABLE_RESPONSIBILITY", "POLICY", "GATE", "UTILITY", "ORCHESTRATION_ONLY", "UNRESOLVED_CANDIDATE"]},
        "disposition": {"enum": ["CURRENT", "DEFERRED", "DUPLICATE", "OBSOLETE"]},
        "registry_state": {"enum": ["REGISTERED", "UNREGISTERED", "NOT_OBSERVED", "UNRESOLVED", "CONFLICTING"]},
        "classification_reason": {"type": "string", "minLength": 1},
        "owner_observation": {"type": "object", "required": ["status"], "properties": {"status": {"enum": ["RESOLVED_FROM_CANONICAL_FIELD", "UNRESOLVED", "CONFLICTING_CLAIMS"]}, "functional_authority_domain": {"type": ["string", "null"]}, "decision_authority": {"type": ["string", "null"]}}, "additionalProperties": false},
        "maturity_observed": {"type": ["string", "null"]},
        "observed_refs": {"type": "object", "additionalProperties": false, "required": ["roles", "prompts", "profiles", "routes", "contracts", "implementation"], "properties": {"roles": {"$ref": "#/$defs/strings"}, "prompts": {"$ref": "#/$defs/strings"}, "profiles": {"$ref": "#/$defs/strings"}, "routes": {"$ref": "#/$defs/strings"}, "contracts": {"$ref": "#/$defs/strings"}, "implementation": {"$ref": "#/$defs/strings"}}},
        "resolved_artifacts": {"$ref": "#/$defs/strings"},
        "inconsistencies": {"$ref": "#/$defs/strings"},
        "evidence_refs": {"$ref": "#/$defs/strings"}
      }
    },
    "strings": {"type": "array", "items": {"type": "string", "minLength": 1}}
  }
}
