{
  "artifact_type": "CAPABILITY_AUDIT_UNIVERSE",
  "candidates": [
    {
      "aliases": [
        "B5_I2_SEMANTIC_AUDITOR"
      ],
      "candidate_id": "B5_I2_SEMANTIC_AUDITOR",
      "canonical_identity": "B5_I2_SEMANTIC_AUDITOR",
      "classification_reason": "Routing-declared candidate absent from canonical registry.",
      "current_registry_presence": false,
      "disposition": "CURRENT",
      "evidence_refs": [
        "config/capability_routing.yaml#B5_I2_SEMANTIC_AUDITOR"
      ],
      "inconsistencies": [],
      "maturity_observed": null,
      "object_class": "UNRESOLVED_CANDIDATE",
      "observed_refs": {
        "contracts": [],
        "implementation": [],
        "profiles": [],
        "prompts": [],
        "roles": [],
        "routes": [
          "config/capability_routing.yaml#B5_I2_SEMANTIC_AUDITOR"
        ]
      },
      "owner_observation": {
        "status": "UNRESOLVED"
      },
      "registry_state": "UNREGISTERED",
      "resolved_artifacts": [],
      "source_refs": [
        "config/capability_routing.yaml#B5_I2_SEMANTIC_AUDITOR"
      ],
      "source_type": "CAPABILITY_ROUTING"
    },
    {
      "aliases": [
        "EDITORIAL_PROFILE_FUNCTIONAL_REVIEW"
      ],
      "candidate_id": "EDITORIAL_PROFILE_FUNCTIONAL_REVIEW",
      "canonical_identity": "EDITORIAL_PROFILE_FUNCTIONAL_REVIEW",
      "classification_reason": "Canonical capability registry entry.",
      "current_registry_presence": true,
      "disposition": "DEFERRED",
      "evidence_refs": [
        "CHANNEL_INTELLIGENCE_REVIEWER",
        "config/capability_registry.json"
      ],
      "inconsistencies": [],
      "maturity_observed": "DEFINED",
      "object_class": "EXECUTABLE_CAPABILITY",
      "observed_refs": {
        "contracts": [],
        "implementation": [],
        "profiles": [],
        "prompts": [],
        "roles": [
          "CHANNEL_INTELLIGENCE_REVIEWER"
        ],
        "routes": []
      },
      "owner_observation": {
        "decision_authority": "CHANNEL_INTELLIGENCE_FUNCTIONAL_REVIEW",
        "functional_authority_domain": "CHANNEL_INTELLIGENCE",
        "status": "RESOLVED_FROM_CANONICAL_FIELD"
      },
      "registry_state": "REGISTERED",
      "resolved_artifacts": [],
      "source_refs": [
        "config/capability_registry.json"
      ],
      "source_type": "CAPABILITY_REGISTRY"
    },
    {
      "aliases": [
        "EDITORIAL_PROFILE_PROPOSAL"
      ],
      "candidate_id": "EDITORIAL_PROFILE_PROPOSAL",
      "canonical_identity": "EDITORIAL_PROFILE_PROPOSAL",
      "classification_reason": "Canonical capability registry entry.",
      "current_registry_presence": true,
      "disposition": "DEFERRED",
      "evidence_refs": [
        "CHANNEL_INTELLIGENCE_PRODUCER",
        "config/capability_registry.json"
      ],
      "inconsistencies": [],
      "maturity_observed": "DEFINED",
      "object_class": "EXECUTABLE_CAPABILITY",
      "observed_refs": {
        "contracts": [],
        "implementation": [],
        "profiles": [],
        "prompts": [],
        "roles": [
          "CHANNEL_INTELLIGENCE_PRODUCER"
        ],
        "routes": []
      },
      "owner_observation": {
        "decision_authority": "CHANNEL_INTELLIGENCE_PROPOSAL",
        "functional_authority_domain": "CHANNEL_INTELLIGENCE",
        "status": "RESOLVED_FROM_CANONICAL_FIELD"
      },
      "registry_state": "REGISTERED",
      "resolved_artifacts": [],
      "source_refs": [
        "config/capability_registry.json"
      ],
      "source_type": "CAPABILITY_REGISTRY"
    },
    {
      "aliases": [
        "IDENTITY_DRIFT_AUDIT"
      ],
      "candidate_id": "IDENTITY_DRIFT_AUDIT",
      "canonical_identity": "IDENTITY_DRIFT_AUDIT",
      "classification_reason": "Canonical capability registry entry.",
      "current_registry_presence": true,
      "disposition": "DEFERRED",
      "evidence_refs": [
        "CHANNEL_INTELLIGENCE_REVIEWER",
        "config/capability_registry.json"
      ],
      "inconsistencies": [],
      "maturity_observed": "DEFINED",
      "object_class": "EXECUTABLE_CAPABILITY",
      "observed_refs": {
        "contracts": [],
        "implementation": [],
        "profiles": [],
        "prompts": [],
        "roles": [
          "CHANNEL_INTELLIGENCE_REVIEWER"
        ],
        "routes": []
      },
      "owner_observation": {
        "decision_authority": "CHANNEL_INTELLIGENCE_AUDIT",
        "functional_authority_domain": "CHANNEL_INTELLIGENCE",
        "status": "RESOLVED_FROM_CANONICAL_FIELD"
      },
      "registry_state": "REGISTERED",
      "resolved_artifacts": [],
      "source_refs": [
        "config/capability_registry.json"
      ],
      "source_type": "CAPABILITY_REGISTRY"
    },
    {
      "aliases": [
        "PROFILE_CHANGE_IMPACT_ASSESSMENT"
      ],
      "candidate_id": "PROFILE_CHANGE_IMPACT_ASSESSMENT",
      "canonical_identity": "PROFILE_CHANGE_IMPACT_ASSESSMENT",
      "classification_reason": "Canonical capability registry entry.",
      "current_registry_presence": true,
      "disposition": "DEFERRED",
      "evidence_refs": [
        "CHANNEL_INTELLIGENCE_PRODUCER",
        "CHANNEL_INTELLIGENCE_REVIEWER",
        "config/capability_registry.json"
      ],
      "inconsistencies": [],
      "maturity_observed": "DEFINED",
      "object_class": "EXECUTABLE_CAPABILITY",
      "observed_refs": {
        "contracts": [],
        "implementation": [],
        "profiles": [],
        "prompts": [],
        "roles": [
          "CHANNEL_INTELLIGENCE_PRODUCER",
          "CHANNEL_INTELLIGENCE_REVIEWER"
        ],
        "routes": []
      },
      "owner_observation": {
        "decision_authority": "CHANNEL_INTELLIGENCE_RECOMMENDATION",
        "functional_authority_domain": "CHANNEL_INTELLIGENCE",
        "status": "RESOLVED_FROM_CANONICAL_FIELD"
      },
      "registry_state": "REGISTERED",
      "resolved_artifacts": [],
      "source_refs": [
        "config/capability_registry.json"
      ],
      "source_type": "CAPABILITY_REGISTRY"
    },
    {
      "aliases": [
        "PROFILE:CHANNEL_INTELLIGENCE_PRODUCER"
      ],
      "candidate_id": "PROFILE:CHANNEL_INTELLIGENCE_PRODUCER",
      "canonical_identity": "PROFILE_CHANNEL_INTELLIGENCE_PRODUCER",
      "classification_reason": "Execution profile is routing configuration, not a product capability.",
      "current_registry_presence": false,
      "disposition": "CURRENT",
      "evidence_refs": [
        "config/agent_execution_profiles.json"
      ],
      "inconsistencies": [],
      "maturity_observed": null,
      "object_class": "ORCHESTRATION_ONLY",
      "observed_refs": {
        "contracts": [],
        "implementation": [],
        "profiles": [],
        "prompts": [],
        "roles": [],
        "routes": []
      },
      "owner_observation": {
        "status": "UNRESOLVED"
      },
      "registry_state": "NOT_OBSERVED",
      "resolved_artifacts": [],
      "source_refs": [
        "config/agent_execution_profiles.json"
      ],
      "source_type": "EXECUTION_PROFILE_REGISTRY"
    },
    {
      "aliases": [
        "PROFILE:CHANNEL_INTELLIGENCE_REVIEWER"
      ],
      "candidate_id": "PROFILE:CHANNEL_INTELLIGENCE_REVIEWER",
      "canonical_identity": "PROFILE_CHANNEL_INTELLIGENCE_REVIEWER",
      "classification_reason": "Execution profile is routing configuration, not a product capability.",
      "current_registry_presence": false,
      "disposition": "CURRENT",
      "evidence_refs": [
        "config/agent_execution_profiles.json"
      ],
      "inconsistencies": [],
      "maturity_observed": null,
      "object_class": "ORCHESTRATION_ONLY",
      "observed_refs": {
        "contracts": [],
        "implementation": [],
        "profiles": [],
        "prompts": [],
        "roles": [],
        "routes": []
      },
      "owner_observation": {
        "status": "UNRESOLVED"
      },
      "registry_state": "NOT_OBSERVED",
      "resolved_artifacts": [],
      "source_refs": [
        "config/agent_execution_profiles.json"
      ],
      "source_type": "EXECUTION_PROFILE_REGISTRY"
    },
    {
      "aliases": [
        "PROFILE:SCRIPT_PRODUCT_AUDITOR"
      ],
      "candidate_id": "PROFILE:SCRIPT_PRODUCT_AUDITOR",
      "canonical_identity": "PROFILE_SCRIPT_PRODUCT_AUDITOR",
      "classification_reason": "Execution profile is routing configuration, not a product capability.",
      "current_registry_presence": false,
      "disposition": "CURRENT",
      "evidence_refs": [
        "config/agent_execution_profiles.json"
      ],
      "inconsistencies": [],
      "maturity_observed": null,
      "object_class": "ORCHESTRATION_ONLY",
      "observed_refs": {
        "contracts": [],
        "implementation": [],
        "profiles": [],
        "prompts": [],
        "roles": [],
        "routes": []
      },
      "owner_observation": {
        "status": "UNRESOLVED"
      },
      "registry_state": "NOT_OBSERVED",
      "resolved_artifacts": [],
      "source_refs": [
        "config/agent_execution_profiles.json"
      ],
      "source_type": "EXECUTION_PROFILE_REGISTRY"
    },
    {
      "aliases": [
        "PROFILE:SCRIPT_PRODUCT_PRODUCER"
      ],
      "candidate_id": "PROFILE:SCRIPT_PRODUCT_PRODUCER",
      "canonical_identity": "PROFILE_SCRIPT_PRODUCT_PRODUCER",
      "classification_reason": "Execution profile is routing configuration, not a product capability.",
      "current_registry_presence": false,
      "disposition": "CURRENT",
      "evidence_refs": [
        "config/agent_execution_profiles.json"
      ],
      "inconsistencies": [],
      "maturity_observed": null,
      "object_class": "ORCHESTRATION_ONLY",
      "observed_refs": {
        "contracts": [],
        "implementation": [],
        "profiles": [],
        "prompts": [],
        "roles": [],
        "routes": []
      },
      "owner_observation": {
        "status": "UNRESOLVED"
      },
      "registry_state": "NOT_OBSERVED",